[
  {
    "id": "pp-site-name",
    "label": "Site Name",
    "name": "site_name",
    "options": null,
    "type": "text"
  },
  {
    "id": "pp-logo",
    "label": "Logo",
    "name": "logo",
    "options": null,
    "type": "group"
  },
  {
    "id": "pp-logo-type",
    "label": "Type",
    "name": "type",
    "options": {
      "options": [
        { "icon": "", "label": "Text", "value": "text" },
        { "icon": "", "label": "Image", "value": "image" }
      ]
    },
    "parent": "logo",
    "type": "select"
  },
  {
    "id": "pp-logo-text",
    "label": "Text",
    "name": "text",
    "options": null,
    "parent": "logo",
    "type": "text"
  },
  {
    "id": "pp-logo-image",
    "label": "Image",
    "name": "image",
    "options": null,
    "parent": "logo",
    "type": "image"
  },
  {
    "id": "pp-favicon",
    "label": "Favicon",
    "name": "favicon",
    "options": null,
    "type": "image"
  },
  {
    "id": "pp-nav-links",
    "label": "Navigation Links",
    "name": "nav_links",
    "options": null,
    "type": "repeater"
  },
  {
    "id": "pp-nav-link",
    "label": "Link",
    "name": "link",
    "options": null,
    "parent": "nav_links",
    "type": "link"
  },
  {
    "id": "pp-header-cta",
    "label": "Header CTA",
    "name": "header_cta",
    "options": null,
    "type": "link"
  },
  {
    "id": "pp-tagline",
    "label": "Tagline",
    "name": "tagline",
    "options": null,
    "type": "text"
  },
  {
    "id": "pp-email",
    "label": "Email",
    "name": "email",
    "options": null,
    "type": "text"
  },
  {
    "id": "pp-phone",
    "label": "Phone",
    "name": "phone",
    "options": null,
    "type": "text"
  },
  {
    "id": "pp-location",
    "label": "Location",
    "name": "location",
    "options": null,
    "type": "text"
  },
  {
    "id": "pp-social-links",
    "label": "Social Links",
    "name": "social_links",
    "options": null,
    "type": "repeater"
  },
  {
    "id": "pp-social-platform",
    "label": "Platform",
    "name": "platform",
    "options": {
      "options": [
        { "icon": "", "label": "Instagram", "value": "instagram" },
        { "icon": "", "label": "Behance", "value": "behance" },
        { "icon": "", "label": "Pinterest", "value": "pinterest" },
        { "icon": "", "label": "LinkedIn", "value": "linkedin" }
      ]
    },
    "parent": "social_links",
    "type": "select"
  },
  {
    "id": "pp-social-url",
    "label": "URL",
    "name": "url",
    "options": null,
    "parent": "social_links",
    "type": "url"
  },
  {
    "id": "pp-copyright",
    "label": "Copyright Text",
    "name": "copyright",
    "options": null,
    "type": "text"
  }
]
