[
  {
    "id": "mf-site-name",
    "name": "site_name",
    "label": "Site Name",
    "type": "text",
    "options": null
  },
  {
    "id": "mf-logo",
    "name": "logo",
    "label": "Logo",
    "type": "group",
    "options": null
  },
  {
    "id": "mf-logo-type",
    "name": "type",
    "label": "Type",
    "type": "select",
    "parent": "logo",
    "options": {
      "options": [
        {"label": "Text", "value": "text", "icon": ""},
        {"label": "Image", "value": "image", "icon": ""}
      ]
    }
  },
  {
    "id": "mf-logo-text",
    "name": "text",
    "label": "Text",
    "type": "text",
    "parent": "logo",
    "options": null
  },
  {
    "id": "mf-logo-image",
    "name": "image",
    "label": "Image",
    "type": "image",
    "parent": "logo",
    "options": null
  },
  {
    "id": "mf-favicon",
    "name": "favicon",
    "label": "Favicon",
    "type": "image",
    "options": null
  },
  {
    "id": "mf-tagline",
    "name": "tagline",
    "label": "Tagline",
    "type": "text",
    "options": null
  },
  {
    "id": "mf-nav-links",
    "name": "nav_links",
    "label": "Navigation Links",
    "type": "repeater",
    "options": null
  },
  {
    "id": "mf-nav-link",
    "name": "link",
    "label": "Link",
    "type": "link",
    "parent": "nav_links",
    "options": null
  },
  {
    "id": "mf-header-cta",
    "name": "header_cta",
    "label": "Header CTA",
    "type": "link",
    "options": null
  },
  {
    "id": "mf-social-links",
    "name": "social_links",
    "label": "Social Links",
    "type": "repeater",
    "options": null
  },
  {
    "id": "mf-social-platform",
    "name": "platform",
    "label": "Platform",
    "type": "select",
    "parent": "social_links",
    "options": {
      "options": [
        {"label": "Twitter/X", "value": "twitter", "icon": ""},
        {"label": "LinkedIn", "value": "linkedin", "icon": ""},
        {"label": "GitHub", "value": "github", "icon": ""},
        {"label": "YouTube", "value": "youtube", "icon": ""}
      ]
    }
  },
  {
    "id": "mf-social-url",
    "name": "url",
    "label": "URL",
    "type": "url",
    "parent": "social_links",
    "options": null
  },
  {
    "id": "mf-footer-links",
    "name": "footer_links",
    "label": "Footer Link Columns",
    "type": "repeater",
    "options": null
  },
  {
    "id": "mf-footer-column-title",
    "name": "column_title",
    "label": "Column Title",
    "type": "text",
    "parent": "footer_links",
    "options": null
  },
  {
    "id": "mf-footer-column-links",
    "name": "links",
    "label": "Links",
    "type": "repeater",
    "parent": "footer_links",
    "options": null
  },
  {
    "id": "mf-footer-link",
    "name": "link",
    "label": "Link",
    "type": "link",
    "parent": "links",
    "options": null
  },
  {
    "id": "mf-copyright",
    "name": "copyright",
    "label": "Copyright Text",
    "type": "text",
    "options": null
  }
]
