[
  {
    "id": "np-site-name",
    "label": "Site Name",
    "name": "site_name",
    "options": null,
    "type": "text"
  },
  {
    "id": "np-logo",
    "label": "Logo",
    "name": "logo",
    "options": null,
    "type": "group"
  },
  {
    "id": "np-logo-type",
    "label": "Type",
    "name": "type",
    "options": {
      "options": [
        { "icon": "", "label": "Text", "value": "text" },
        { "icon": "", "label": "Image", "value": "image" }
      ]
    },
    "parent": "logo",
    "type": "select"
  },
  {
    "id": "np-logo-text",
    "label": "Text",
    "name": "text",
    "options": null,
    "parent": "logo",
    "type": "text"
  },
  {
    "id": "np-logo-image",
    "label": "Image",
    "name": "image",
    "options": null,
    "parent": "logo",
    "type": "image"
  },
  {
    "id": "np-favicon",
    "label": "Favicon",
    "name": "favicon",
    "options": null,
    "type": "image"
  },
  {
    "id": "np-nav-links",
    "label": "Navigation Links",
    "name": "nav_links",
    "options": null,
    "type": "repeater"
  },
  {
    "id": "np-nav-link",
    "label": "Link",
    "name": "link",
    "options": null,
    "parent": "nav_links",
    "type": "link"
  },
  {
    "id": "np-header-cta",
    "label": "Header CTA (Donate Button)",
    "name": "header_cta",
    "options": null,
    "type": "link"
  },
  {
    "id": "np-tagline",
    "label": "Tagline",
    "name": "tagline",
    "options": null,
    "type": "text"
  },
  {
    "id": "np-phone",
    "label": "Phone",
    "name": "phone",
    "options": null,
    "type": "text"
  },
  {
    "id": "np-email",
    "label": "Email",
    "name": "email",
    "options": null,
    "type": "text"
  },
  {
    "id": "np-address",
    "label": "Address",
    "name": "address",
    "options": null,
    "type": "text"
  },
  {
    "id": "np-social-links",
    "label": "Social Links",
    "name": "social_links",
    "options": null,
    "type": "repeater"
  },
  {
    "id": "np-social-platform",
    "label": "Platform",
    "name": "platform",
    "options": {
      "options": [
        { "icon": "", "label": "Instagram", "value": "instagram" },
        { "icon": "", "label": "Facebook", "value": "facebook" },
        { "icon": "", "label": "Twitter/X", "value": "twitter" },
        { "icon": "", "label": "LinkedIn", "value": "linkedin" },
        { "icon": "", "label": "YouTube", "value": "youtube" }
      ]
    },
    "parent": "social_links",
    "type": "select"
  },
  {
    "id": "np-social-url",
    "label": "URL",
    "name": "url",
    "options": null,
    "parent": "social_links",
    "type": "url"
  },
  {
    "id": "np-ein",
    "label": "EIN Number",
    "name": "ein",
    "options": null,
    "type": "text"
  },
  {
    "id": "np-copyright",
    "label": "Copyright Text",
    "name": "copyright",
    "options": null,
    "type": "text"
  }
]
