[
  {
    "id": "cs-site-name",
    "label": "Site Name",
    "name": "site_name",
    "options": null,
    "type": "text"
  },
  {
    "id": "cs-logo",
    "label": "Logo",
    "name": "logo",
    "options": null,
    "type": "group"
  },
  {
    "id": "cs-logo-type",
    "label": "Type",
    "name": "type",
    "options": {
      "options": [
        { "icon": "", "label": "Text", "value": "text" },
        { "icon": "", "label": "Image", "value": "image" }
      ]
    },
    "parent": "logo",
    "type": "select"
  },
  {
    "id": "cs-logo-text",
    "label": "Text",
    "name": "text",
    "options": null,
    "parent": "logo",
    "type": "text"
  },
  {
    "id": "cs-logo-image",
    "label": "Image",
    "name": "image",
    "options": null,
    "parent": "logo",
    "type": "image"
  },
  {
    "id": "cs-favicon",
    "label": "Favicon",
    "name": "favicon",
    "options": null,
    "type": "image"
  },
  {
    "id": "cs-nav-links",
    "label": "Navigation Links",
    "name": "nav_links",
    "options": null,
    "type": "repeater"
  },
  {
    "id": "cs-nav-link",
    "label": "Link",
    "name": "link",
    "options": null,
    "parent": "nav_links",
    "type": "link"
  },
  {
    "id": "cs-header-cta",
    "label": "Header CTA",
    "name": "header_cta",
    "options": null,
    "type": "link"
  },
  {
    "id": "cs-tagline",
    "label": "Tagline",
    "name": "tagline",
    "options": null,
    "type": "text"
  },
  {
    "id": "cs-phone",
    "label": "Phone",
    "name": "phone",
    "options": null,
    "type": "text"
  },
  {
    "id": "cs-email",
    "label": "Email",
    "name": "email",
    "options": null,
    "type": "text"
  },
  {
    "id": "cs-address",
    "label": "Address",
    "name": "address",
    "options": null,
    "type": "text"
  },
  {
    "id": "cs-social-links",
    "label": "Social Links",
    "name": "social_links",
    "options": null,
    "type": "repeater"
  },
  {
    "id": "cs-social-platform",
    "label": "Platform",
    "name": "platform",
    "options": {
      "options": [
        { "icon": "", "label": "Instagram", "value": "instagram" },
        { "icon": "", "label": "Facebook", "value": "facebook" },
        { "icon": "", "label": "Twitter/X", "value": "twitter" },
        { "icon": "", "label": "TikTok", "value": "tiktok" }
      ]
    },
    "parent": "social_links",
    "type": "select"
  },
  {
    "id": "cs-social-url",
    "label": "URL",
    "name": "url",
    "options": null,
    "parent": "social_links",
    "type": "url"
  },
  {
    "id": "cs-hours",
    "label": "Hours",
    "name": "hours",
    "options": null,
    "type": "repeater"
  },
  {
    "id": "cs-hours-days",
    "label": "Days",
    "name": "days",
    "options": null,
    "parent": "hours",
    "type": "text"
  },
  {
    "id": "cs-hours-time",
    "label": "Time",
    "name": "time",
    "options": null,
    "parent": "hours",
    "type": "text"
  },
  {
    "id": "cs-copyright",
    "label": "Copyright Text",
    "name": "copyright",
    "options": null,
    "type": "text"
  }
]
