[
  {
    "id": "site-name",
    "label": "Site Name",
    "name": "site_name",
    "options": null,
    "type": "text"
  },
  {
    "id": "site-logo",
    "label": "Logo",
    "name": "logo",
    "options": null,
    "type": "group"
  },
  {
    "id": "logo-type",
    "label": "Type",
    "name": "type",
    "options": {
      "options": [
        {"icon": "", "label": "Text", "value": "text"},
        {"icon": "", "label": "Image", "value": "image"}
      ]
    },
    "parent": "logo",
    "type": "select"
  },
  {
    "id": "logo-text",
    "label": "Text",
    "name": "text",
    "options": null,
    "parent": "logo",
    "type": "text"
  },
  {
    "id": "logo-image",
    "label": "Image",
    "name": "image",
    "options": null,
    "parent": "logo",
    "type": "image"
  },
  {
    "id": "site-favicon",
    "label": "Favicon",
    "name": "favicon",
    "options": null,
    "type": "image"
  },
  {
    "id": "nav-links",
    "label": "Navigation Links",
    "name": "nav_links",
    "options": null,
    "type": "repeater"
  },
  {
    "id": "nav-link",
    "label": "Link",
    "name": "link",
    "options": null,
    "parent": "nav_links",
    "type": "link"
  },
  {
    "id": "header-cta",
    "label": "Header CTA",
    "name": "header_cta",
    "options": null,
    "type": "link"
  },
  {
    "id": "social-links",
    "label": "Social Links",
    "name": "social_links",
    "options": null,
    "type": "repeater"
  },
  {
    "id": "social-platform",
    "label": "Platform",
    "name": "platform",
    "options": {
      "options": [
        {"icon": "", "label": "GitHub", "value": "github"},
        {"icon": "", "label": "LinkedIn", "value": "linkedin"},
        {"icon": "", "label": "Twitter/X", "value": "twitter"},
        {"icon": "", "label": "Email", "value": "email"},
        {"icon": "", "label": "Dribbble", "value": "dribbble"},
        {"icon": "", "label": "CodePen", "value": "codepen"}
      ]
    },
    "parent": "social_links",
    "type": "select"
  },
  {
    "id": "social-url",
    "label": "URL",
    "name": "url",
    "options": null,
    "parent": "social_links",
    "type": "url"
  },
  {
    "id": "footer-tagline",
    "label": "Footer Tagline",
    "name": "tagline",
    "options": null,
    "type": "text"
  },
  {
    "id": "copyright-text",
    "label": "Copyright Text",
    "name": "copyright",
    "options": null,
    "type": "text"
  }
]
