[
  {
    "id": "site-name",
    "label": "Site Name",
    "name": "site_name",
    "options": null,
    "type": "text"
  },
  {
    "id": "site-logo",
    "label": "Logo",
    "name": "logo",
    "options": null,
    "type": "group"
  },
  {
    "id": "logo-type",
    "label": "Type",
    "name": "type",
    "options": {
      "options": [
        {"icon": "", "label": "Text", "value": "text"},
        {"icon": "", "label": "Image", "value": "image"}
      ]
    },
    "parent": "logo",
    "type": "select"
  },
  {
    "id": "logo-text",
    "label": "Text",
    "name": "text",
    "options": null,
    "parent": "logo",
    "type": "text"
  },
  {
    "id": "logo-image",
    "label": "Image",
    "name": "image",
    "options": null,
    "parent": "logo",
    "type": "image"
  },
  {
    "id": "site-favicon",
    "label": "Favicon",
    "name": "favicon",
    "options": null,
    "type": "image"
  },
  {
    "id": "site-nav-links",
    "label": "Navigation Links",
    "name": "nav_links",
    "options": null,
    "type": "repeater"
  },
  {
    "id": "nav-link",
    "label": "Link",
    "name": "link",
    "options": null,
    "parent": "nav_links",
    "type": "link"
  },
  {
    "id": "site-header-cta",
    "label": "Header CTA",
    "name": "header_cta",
    "options": null,
    "type": "link"
  },
  {
    "id": "site-tagline",
    "label": "Footer Tagline",
    "name": "tagline",
    "options": null,
    "type": "text"
  },
  {
    "id": "site-social-links",
    "label": "Social Links",
    "name": "social_links",
    "options": null,
    "type": "repeater"
  },
  {
    "id": "social-platform",
    "label": "Platform",
    "name": "platform",
    "options": {
      "options": [
        {"icon": "", "label": "Facebook", "value": "facebook"},
        {"icon": "", "label": "Instagram", "value": "instagram"},
        {"icon": "", "label": "Twitter/X", "value": "twitter"},
        {"icon": "", "label": "YouTube", "value": "youtube"}
      ]
    },
    "parent": "social_links",
    "type": "select"
  },
  {
    "id": "social-url",
    "label": "URL",
    "name": "url",
    "options": null,
    "parent": "social_links",
    "type": "url"
  },
  {
    "id": "site-footer-link-groups",
    "label": "Footer Link Groups",
    "name": "footer_link_groups",
    "options": null,
    "type": "repeater"
  },
  {
    "id": "footer-group-title",
    "label": "Group Title",
    "name": "title",
    "options": null,
    "parent": "footer_link_groups",
    "type": "text"
  },
  {
    "id": "footer-group-links",
    "label": "Links",
    "name": "links",
    "options": null,
    "parent": "footer_link_groups",
    "type": "repeater"
  },
  {
    "id": "footer-link",
    "label": "Link",
    "name": "link",
    "options": null,
    "parent": "links",
    "type": "link"
  },
  {
    "id": "site-copyright",
    "label": "Copyright Text",
    "name": "copyright",
    "options": null,
    "type": "text"
  }
]
