[
  {
    "id": "vyu16byk3j5954w",
    "label": "Site Name",
    "name": "site_name",
    "options": null,
    "type": "text"
  },
  {
    "id": "37qzukvulhnhbl4",
    "label": "Logo",
    "name": "logo",
    "options": null,
    "type": "group"
  },
  {
    "id": "qysj92hxz3y6qqo",
    "label": "Type",
    "name": "type",
    "options": {
      "options": [
        {
          "icon": "solar:text-bold",
          "label": "Text",
          "value": "text"
        },
        {
          "icon": "material-symbols:image",
          "label": "Image",
          "value": "image"
        }
      ]
    },
    "parent": "logo",
    "type": "select"
  },
  {
    "id": "toeqyf23f1meh2i",
    "label": "Text",
    "name": "text",
    "options": {
      "condition": {
        "comparison": "=",
        "field": "qysj92hxz3y6qqo",
        "value": "text"
      }
    },
    "parent": "logo",
    "type": "text"
  },
  {
    "id": "qb8rfbz7imbx28e",
    "label": "Image",
    "name": "image",
    "options": {
      "condition": {
        "comparison": "=",
        "field": "qysj92hxz3y6qqo",
        "value": "image"
      }
    },
    "parent": "logo",
    "type": "image"
  },
  {
    "id": "dr6rhlbded30dle",
    "label": "Favicon",
    "name": "favicon",
    "options": {
      "maxSizeMB": 1,
      "maxWidthOrHeight": 1920
    },
    "type": "image"
  },
  {
    "id": "eyperqi0s17knkw",
    "label": "Site Navigation Links",
    "name": "site_navigation_links",
    "options": null,
    "type": "repeater"
  },
  {
    "id": "gmd6wu28sc40rny",
    "label": "Link",
    "name": "link",
    "options": null,
    "parent": "site_navigation_links",
    "type": "link"
  },
  {
    "id": "zhpv3p9m1iqk493",
    "label": "Footer Tagline",
    "name": "tagline",
    "options": null,
    "type": "text"
  },
  {
    "id": "upab7c7eums3mbl",
    "label": "Social Links",
    "name": "social_links",
    "options": null,
    "type": "repeater"
  },
  {
    "id": "0lypdociofv3fa0",
    "label": "Platform",
    "name": "platform",
    "options": {
      "options": [
        {
          "icon": "mdi:linkedin",
          "label": "LinkedIn",
          "value": "linkedin"
        },
        {
          "icon": "mdi:twitter",
          "label": "Twitter/X",
          "value": "twitter"
        },
        {
          "icon": "mdi:facebook",
          "label": "Facebook",
          "value": "facebook"
        },
        {
          "icon": "mdi:instagram",
          "label": "Instagram",
          "value": "instagram"
        },
        {
          "icon": "mdi:youtube",
          "label": "YouTube",
          "value": "youtube"
        }
      ]
    },
    "parent": "social_links",
    "type": "select"
  },
  {
    "id": "tc65dzdbdn20k4m",
    "label": "URL",
    "name": "url",
    "options": null,
    "parent": "social_links",
    "type": "text"
  },
  {
    "id": "gihak5w5ij3wr6m",
    "label": "Newsletter Title",
    "name": "newsletter_title",
    "options": null,
    "type": "text"
  },
  {
    "id": "nqcpuwqnv6g4kh6",
    "label": "Newsletter Text",
    "name": "newsletter_text",
    "options": null,
    "type": "text"
  },
  {
    "id": "un06wa1bqpa8wr4",
    "label": "Newsletter Form Endpoint",
    "name": "newsletter_endpoint",
    "options": null,
    "type": "text"
  },
  {
    "id": "skja3icg5845qp2",
    "label": "Footer Link Groups",
    "name": "link_groups",
    "options": null,
    "type": "repeater"
  },
  {
    "id": "qxegyg5as3plcu6",
    "label": "Group Title",
    "name": "title",
    "options": null,
    "parent": "link_groups",
    "type": "text"
  },
  {
    "id": "nqt3nseo23km8kl",
    "label": "Links",
    "name": "links",
    "options": null,
    "parent": "link_groups",
    "type": "repeater"
  },
  {
    "id": "jp0qz53r8bdniwb",
    "label": "Link",
    "name": "link",
    "options": null,
    "parent": "links",
    "type": "link"
  },
  {
    "id": "jun2dxf3ux4n4rn",
    "label": "Copyright Text",
    "name": "copyright",
    "options": null,
    "type": "text"
  }
]