[
  {
    "id": "site-name",
    "name": "site_name",
    "label": "Site Name",
    "type": "text",
    "options": null
  },
  {
    "id": "site-logo",
    "name": "logo",
    "label": "Logo",
    "type": "group",
    "options": null
  },
  {
    "id": "logo-type",
    "name": "type",
    "label": "Type",
    "type": "select",
    "parent": "logo",
    "options": {
      "options": [
        {"label": "Text", "value": "text", "icon": ""},
        {"label": "Image", "value": "image", "icon": ""}
      ]
    }
  },
  {
    "id": "logo-text",
    "name": "text",
    "label": "Text",
    "type": "text",
    "parent": "logo",
    "options": null
  },
  {
    "id": "logo-image",
    "name": "image",
    "label": "Image",
    "type": "image",
    "parent": "logo",
    "options": null
  },
  {
    "id": "site-nav-links",
    "name": "nav_links",
    "label": "Navigation Links",
    "type": "repeater",
    "options": null
  },
  {
    "id": "nav-link",
    "name": "link",
    "label": "Link",
    "type": "link",
    "parent": "nav_links",
    "options": null
  },
  {
    "id": "site-header-cta",
    "name": "header_cta",
    "label": "Header CTA",
    "type": "link",
    "options": null
  },
  {
    "id": "site-phone",
    "name": "phone",
    "label": "Phone Number",
    "type": "text",
    "options": null
  },
  {
    "id": "site-email",
    "name": "email",
    "label": "Email",
    "type": "text",
    "options": null
  },
  {
    "id": "site-address",
    "name": "address",
    "label": "Address",
    "type": "text",
    "options": null
  },
  {
    "id": "site-social-links",
    "name": "social_links",
    "label": "Social Links",
    "type": "repeater",
    "options": null
  },
  {
    "id": "social-platform",
    "name": "platform",
    "label": "Platform",
    "type": "select",
    "parent": "social_links",
    "options": {
      "options": [
        {"label": "Instagram", "value": "instagram", "icon": ""},
        {"label": "Facebook", "value": "facebook", "icon": ""},
        {"label": "Pinterest", "value": "pinterest", "icon": ""},
        {"label": "LinkedIn", "value": "linkedin", "icon": ""}
      ]
    }
  },
  {
    "id": "social-url",
    "name": "url",
    "label": "URL",
    "type": "url",
    "parent": "social_links",
    "options": null
  },
  {
    "id": "site-copyright",
    "name": "copyright",
    "label": "Copyright Text",
    "type": "text",
    "options": null
  }
]
