[
  {
    "id": "ia5wcveoj1s376l",
    "label": "Site Name",
    "name": "site_name",
    "options": null,
    "type": "text"
  },
  {
    "id": "lj3zui0snfl8tf0",
    "label": "Logo",
    "name": "logo",
    "options": null,
    "type": "group"
  },
  {
    "id": "rg5a3cd0y56dnss",
    "label": "Type",
    "name": "type",
    "options": {
      "options": [
        {
          "icon": "",
          "label": "Text",
          "value": "text"
        },
        {
          "icon": "",
          "label": "Image",
          "value": "image"
        }
      ]
    },
    "parent": "logo",
    "type": "select"
  },
  {
    "id": "3781wumsn7n6fq4",
    "label": "Text",
    "name": "text",
    "options": null,
    "parent": "logo",
    "type": "text"
  },
  {
    "id": "pm14eermhxpinbj",
    "label": "Image",
    "name": "image",
    "options": null,
    "parent": "logo",
    "type": "image"
  },
  {
    "id": "3had3seewpuw13j",
    "label": "Favicon",
    "name": "favicon",
    "options": null,
    "type": "image"
  },
  {
    "id": "ohz8t003zq02sgz",
    "label": "Navigation Links",
    "name": "nav_links",
    "options": null,
    "type": "repeater"
  },
  {
    "id": "v3wfslntlceg0fm",
    "label": "Link",
    "name": "link",
    "options": null,
    "parent": "nav_links",
    "type": "link"
  },
  {
    "id": "sjtp94f9cs40qv2",
    "label": "Header CTA",
    "name": "header_cta",
    "options": null,
    "type": "link"
  },
  {
    "id": "emjdl9k2jendxec",
    "label": "Footer Tagline",
    "name": "tagline",
    "options": null,
    "type": "text"
  },
  {
    "id": "quv9ri9t82i1nwe",
    "label": "Social Links",
    "name": "social_links",
    "options": null,
    "type": "repeater"
  },
  {
    "id": "sil1rqgo9z7nz5c",
    "label": "Platform",
    "name": "platform",
    "options": {
      "options": [
        {
          "icon": "",
          "label": "Twitter/X",
          "value": "twitter"
        },
        {
          "icon": "",
          "label": "LinkedIn",
          "value": "linkedin"
        },
        {
          "icon": "",
          "label": "GitHub",
          "value": "github"
        },
        {
          "icon": "",
          "label": "Facebook",
          "value": "facebook"
        },
        {
          "icon": "",
          "label": "Instagram",
          "value": "instagram"
        },
        {
          "icon": "",
          "label": "YouTube",
          "value": "youtube"
        }
      ]
    },
    "parent": "social_links",
    "type": "select"
  },
  {
    "id": "y83303tuqveeg7t",
    "label": "URL",
    "name": "url",
    "options": null,
    "parent": "social_links",
    "type": "url"
  },
  {
    "id": "a58occqjgz6rz1v",
    "label": "Footer Link Groups",
    "name": "footer_link_groups",
    "options": null,
    "type": "repeater"
  },
  {
    "id": "g30t8lgkwlfn7bg",
    "label": "Group Title",
    "name": "title",
    "options": null,
    "parent": "footer_link_groups",
    "type": "text"
  },
  {
    "id": "eb6krbvle4kffwy",
    "label": "Links",
    "name": "links",
    "options": null,
    "parent": "footer_link_groups",
    "type": "repeater"
  },
  {
    "id": "f2pwabyfts03qih",
    "label": "Link",
    "name": "link",
    "options": null,
    "parent": "links",
    "type": "link"
  },
  {
    "id": "1brayjm05ew1uvo",
    "label": "Copyright Text",
    "name": "copyright",
    "options": null,
    "type": "text"
  }
]