[
  {
    "id": "site-name",
    "name": "site_name",
    "label": "Site Name",
    "type": "text",
    "options": null
  },
  {
    "id": "site-logo",
    "name": "logo",
    "label": "Logo",
    "type": "group",
    "options": null
  },
  {
    "id": "logo-type",
    "name": "type",
    "label": "Type",
    "type": "select",
    "parent": "logo",
    "options": {
      "options": [
        {"label": "Text", "value": "text", "icon": ""},
        {"label": "Image", "value": "image", "icon": ""}
      ]
    }
  },
  {
    "id": "logo-text",
    "name": "text",
    "label": "Text",
    "type": "text",
    "parent": "logo",
    "options": null
  },
  {
    "id": "logo-image",
    "name": "image",
    "label": "Image",
    "type": "image",
    "parent": "logo",
    "options": null
  },
  {
    "id": "site-favicon",
    "name": "favicon",
    "label": "Favicon",
    "type": "image",
    "options": null
  },
  {
    "id": "site-nav-links",
    "name": "nav_links",
    "label": "Navigation Links",
    "type": "repeater",
    "options": null
  },
  {
    "id": "nav-link",
    "name": "link",
    "label": "Link",
    "type": "link",
    "parent": "nav_links",
    "options": null
  },
  {
    "id": "site-header-cta",
    "name": "header_cta",
    "label": "Header CTA",
    "type": "link",
    "options": null
  },
  {
    "id": "site-tagline",
    "name": "tagline",
    "label": "Footer Tagline",
    "type": "text",
    "options": null
  },
  {
    "id": "site-social-links",
    "name": "social_links",
    "label": "Social Links",
    "type": "repeater",
    "options": null
  },
  {
    "id": "social-platform",
    "name": "platform",
    "label": "Platform",
    "type": "select",
    "parent": "social_links",
    "options": {
      "options": [
        {"label": "Twitter/X", "value": "twitter", "icon": ""},
        {"label": "LinkedIn", "value": "linkedin", "icon": ""},
        {"label": "Instagram", "value": "instagram", "icon": ""},
        {"label": "Facebook", "value": "facebook", "icon": ""},
        {"label": "YouTube", "value": "youtube", "icon": ""},
        {"label": "GitHub", "value": "github", "icon": ""}
      ]
    }
  },
  {
    "id": "social-url",
    "name": "url",
    "label": "URL",
    "type": "url",
    "parent": "social_links",
    "options": null
  },
  {
    "id": "site-footer-links",
    "name": "footer_link_groups",
    "label": "Footer Link Groups",
    "type": "repeater",
    "options": null
  },
  {
    "id": "footer-group-title",
    "name": "title",
    "label": "Group Title",
    "type": "text",
    "parent": "footer_link_groups",
    "options": null
  },
  {
    "id": "footer-group-links",
    "name": "links",
    "label": "Links",
    "type": "repeater",
    "parent": "footer_link_groups",
    "options": null
  },
  {
    "id": "footer-link",
    "name": "link",
    "label": "Link",
    "type": "link",
    "parent": "links",
    "options": null
  },
  {
    "id": "site-copyright",
    "name": "copyright",
    "label": "Copyright Text",
    "type": "text",
    "options": null
  }
]
